{
  "$schema": "./schema.json",
  "version": "2026.09.13",
  "jurisdiction": "IN",
  "regulator": "Reserve Bank of India",
  "notes": "Every rule carries its source and effective dates. Rules with status 'active' may generate a claim; 'suggest' rules only raise a 'needs checking' finding until a second reviewer confirms the text and dates. Dates use ISO-8601. Amounts in INR.",
  "rules": [
    {
      "id": "RBI-TAT-2019-ATM",
      "title": "Failed ATM withdrawal not reversed within T+5 → ₹100/day compensation",
      "category": "failed_transaction",
      "status": "active",
      "right_en": "If cash was not dispensed but your account was debited, the bank must reverse it within 5 days. After that it owes you ₹100 for every day of delay — automatically, without a complaint.",
      "right_ta": "ATM-ல பணம் வரல, ஆனா account-ல debit ஆயிடுச்சுன்னா, 5 நாளுக்குள்ள bank திருப்பி தரணும். அதுக்கு அப்புறம் ஒவ்வொரு நாளும் ₹100 bank உங்களுக்கு கடன்.",
      "source": { "circular": "RBI/2019-20/67 DPSS.CO.PD No.629/02.01.014/2019-20", "title": "Harmonisation of Turn Around Time (TAT) and customer compensation for failed transactions using authorised Payment Systems", "date": "2019-09-20", "url": "https://www.rbi.org.in/commonman/English/scripts/Notification.aspx?Id=3074" },
      "effective_from": "2019-10-15",
      "effective_to": null,
      "evaluable_from": ["statement"],
      "parameters": { "tat_days": 5, "compensation_per_day": 100, "channels": ["ATM"] },
      "formula": "days_late = (reversal_date or today) - (debit_date + tat_days); compensation = max(0, days_late) * 100",
      "evidence_required": ["debit line", "reversal line or absence of reversal", "days computed"],
      "compensation_type": "statutory"
    },
    {
      "id": "RBI-TAT-2019-UPI",
      "title": "Failed UPI / IMPS / card-to-card transfer not reversed within T+1 → ₹100/day",
      "category": "failed_transaction",
      "status": "active",
      "right_en": "If a UPI or IMPS payment was debited but the beneficiary did not receive it, auto-reversal is due by T+1. After that the bank owes ₹100 per day.",
      "right_ta": "UPI/IMPS-ல பணம் போயிடுச்சு ஆனா அடுத்தவங்களுக்கு வரல-ன்னா, அடுத்த நாளுக்குள்ள திரும்பணும். அப்புறம் ஒவ்வொரு நாளும் ₹100.",
      "source": { "circular": "RBI/2019-20/67", "title": "Harmonisation of TAT and customer compensation for failed transactions", "date": "2019-09-20", "url": "https://www.rbi.org.in/commonman/English/scripts/Notification.aspx?Id=3074" },
      "effective_from": "2019-10-15",
      "effective_to": null,
      "evaluable_from": ["statement"],
      "parameters": { "tat_days": 1, "compensation_per_day": 100, "channels": ["UPI", "IMPS", "CARD"] },
      "formula": "days_late = (reversal_date or today) - (debit_date + 1); compensation = max(0, days_late) * 100",
      "evidence_required": ["debit line", "reversal line or absence of reversal", "days computed"],
      "compensation_type": "statutory"
    },
    {
      "id": "RBI-TAT-2019-POS",
      "title": "Failed PoS / e-commerce card transaction not reversed within T+5 → ₹100/day",
      "category": "failed_transaction",
      "status": "active",
      "right_en": "A card payment at a shop or website that failed but was debited must be reversed within 5 days; ₹100/day after that.",
      "right_ta": "கடையிலோ online-லோ card payment fail ஆயி debit ஆயிடுச்சுன்னா 5 நாளுக்குள்ள திரும்பணும்; அப்புறம் ₹100/நாள்.",
      "source": { "circular": "RBI/2019-20/67", "title": "Harmonisation of TAT and customer compensation for failed transactions", "date": "2019-09-20", "url": "https://www.rbi.org.in/commonman/English/scripts/Notification.aspx?Id=3074" },
      "effective_from": "2019-10-15",
      "effective_to": null,
      "evaluable_from": ["statement"],
      "parameters": { "tat_days": 5, "compensation_per_day": 100, "channels": ["POS", "ECOM"] },
      "formula": "days_late = (reversal_date or today) - (debit_date + 5); compensation = max(0, days_late) * 100",
      "evidence_required": ["debit line", "reversal line or absence of reversal"],
      "compensation_type": "statutory"
    },
    {
      "id": "RBI-MINBAL-2014-NOTICE",
      "title": "Minimum-balance penalty without prior notice and one-month cure period",
      "category": "charges",
      "status": "active",
      "right_en": "Before charging you for a low balance, the bank must tell you (SMS/email/letter) and give you one month to top up. A penalty with no warning is not allowed.",
      "right_ta": "Minimum balance-க்கு charge பண்றதுக்கு முன்னாடி bank உங்களுக்கு SMS/email அனுப்பி ஒரு மாசம் time தரணும். எச்சரிக்கை இல்லாம charge பண்ண கூடாது.",
      "source": { "circular": "RBI/2014-15/308 DBR.Dir.BC.No.47/13.03.00/2014-15", "title": "Levy of penal charges on non-maintenance of minimum balances in savings bank accounts", "date": "2014-11-20", "url": "https://www.rbi.org.in/commonman/English/Scripts/Notification.aspx?Id=1500" },
      "effective_from": "2015-04-01",
      "effective_to": null,
      "evaluable_from": ["statement", "user"],
      "parameters": { "cure_period_days": 30 },
      "formula": "penalty is claimable if no notice was received in the 30 days before the charge (user-confirmed) OR balance was above minimum throughout the prior month per statement",
      "evidence_required": ["penalty line", "balance path for prior month", "user answer: notice received?"],
      "questions": [{ "id": "notice_received", "en": "Did you get an SMS, email or letter warning you about a low balance in the month before this charge?", "ta": "இந்த charge-க்கு முன்னாடி மாசத்துல balance கம்மி-ன்னு SMS/email வந்துச்சா?", "options": ["yes", "no", "not_sure"] }],
      "compensation_type": "refund"
    },
    {
      "id": "RBI-MINBAL-2014-PROPORTION",
      "title": "Minimum-balance penalty must be proportionate to the shortfall",
      "category": "charges",
      "status": "active",
      "right_en": "The penalty must be a fixed percentage of how far you were below the minimum — not a flat fee larger than the shortfall itself.",
      "right_ta": "Penalty, குறைஞ்ச தொகைக்கு ஏத்த மாதிரி இருக்கணும் — குறைவை விட பெரிய flat fee கூடாது.",
      "source": { "circular": "RBI/2014-15/308", "title": "Levy of penal charges on non-maintenance of minimum balances", "date": "2014-11-20", "url": "https://www.rbi.org.in/commonman/English/Scripts/Notification.aspx?Id=1500" },
      "effective_from": "2015-04-01",
      "effective_to": null,
      "evaluable_from": ["statement", "profile"],
      "parameters": {},
      "formula": "flag if penalty_amount > shortfall_amount (min_balance_required - lowest_balance_in_month)",
      "evidence_required": ["penalty line", "lowest balance in month", "minimum balance requirement from profile"],
      "compensation_type": "refund"
    },
    {
      "id": "RBI-MINBAL-2014-NEGATIVE",
      "title": "Charges may not push the balance negative",
      "category": "charges",
      "status": "active",
      "right_en": "A minimum-balance charge can never take your account below zero.",
      "right_ta": "Minimum balance charge-னால உங்க account minus-க்கு போக கூடாது.",
      "source": { "circular": "RBI/2014-15/308", "title": "Levy of penal charges on non-maintenance of minimum balances", "date": "2014-11-20", "url": "https://www.rbi.org.in/commonman/English/Scripts/Notification.aspx?Id=1500" },
      "effective_from": "2015-04-01",
      "effective_to": null,
      "evaluable_from": ["statement"],
      "parameters": {},
      "formula": "flag if balance_after_charge < 0 and charge kind == MIN_BAL_PENALTY",
      "evidence_required": ["penalty line", "resulting balance"],
      "compensation_type": "refund"
    },
    {
      "id": "RBI-ATM-2025-FREE",
      "title": "ATM charge within the free-transaction allowance",
      "category": "charges",
      "status": "active",
      "right_en": "You get 5 free transactions a month at your own bank's ATMs and 3 (metro) or 5 (non-metro) at other banks. Balance enquiries count. A charge before you cross the limit is wrong.",
      "right_ta": "சொந்த bank ATM-ல மாசம் 5, வேற bank ATM-ல metro-ல 3 / மத்த ஊர்ல 5 முறை free. அதுக்குள்ள charge பண்ணா தப்பு.",
      "source": { "circular": "RBI/2024-25/125 CO.DPSS.POLC.No.S1268/02-10-002/2024-2025", "title": "Usage of ATMs / Cash Recycler Machines – Review of Interchange Fee and Customer Charges", "date": "2025-03-28", "url": "https://www.rbi.org.in/scripts/NotificationUser.aspx?Id=12111" },
      "effective_from": "2025-05-01",
      "effective_to": null,
      "evaluable_from": ["statement", "profile"],
      "parameters": { "free_own": 5, "free_other_metro": 3, "free_other_nonmetro": 5, "count_non_financial": true },
      "formula": "for each month: count ATM txns own/other; any ATM charge levied while count <= free limit is wrongful",
      "evidence_required": ["ATM transaction lines for the month", "charge line", "city tier from profile"],
      "compensation_type": "refund"
    },
    {
      "id": "RBI-ATM-2025-CAP",
      "title": "ATM charge above the ₹23 cap",
      "category": "charges",
      "status": "active",
      "right_en": "Beyond the free limit a bank may charge at most ₹23 per transaction (plus tax). More than that is over the cap.",
      "right_ta": "Free limit தாண்டினா ஒரு transaction-க்கு அதிகபட்சம் ₹23 (+ tax) தான். அதுக்கு மேல charge பண்ண கூடாது.",
      "source": { "circular": "RBI/2024-25/125", "title": "Usage of ATMs – Review of Interchange Fee and Customer Charges", "date": "2025-03-28", "url": "https://www.rbi.org.in/scripts/NotificationUser.aspx?Id=12111" },
      "effective_from": "2025-05-01",
      "effective_to": null,
      "evaluable_from": ["statement"],
      "parameters": { "cap": 23, "gst_rate": 0.18 },
      "formula": "flag ATM charge line if amount > cap * (1 + gst_rate) + 0.5",
      "evidence_required": ["charge line"],
      "compensation_type": "refund",
      "supersedes": "RBI-ATM-2021-CAP"
    },
    {
      "id": "RBI-ATM-2021-CAP",